{
  "schema_version": 2,
  "kind": "diagram-annotation",
  "diagram_id": "distill-rnn-memory",
  "source_url": "https://raw.githubusercontent.com/distillpub/post--augmented-rnns/fdc3526167133f5a97cee9e7cb48af293e67d66d/public/assets/rnn_memory.svg",
  "source_sha256": "c81ed722d5bee6e02681c0b934c6ab2fef72c7649ecc7fefb35767eba92af5b7",
  "license": "CC-BY-2.0",
  "split": "development",
  "review": {
    "status": "agent-reviewed",
    "annotator_type": "agent",
    "annotator": "Codex native-pilot development review",
    "evidence": "Agent visually inspected the original render and source on 2026-10-30. Scripted selectors transcribe that interpretation; no author approval, independent human labels or automatic recovery claim."
  },
  "objects": [
    {
      "id": "memory1",
      "name": "Second memory-array state",
      "parts": [
        "svg/use[4]",
        "svg/use[54]",
        "svg/use[55]",
        "svg/use[56]",
        "svg/use[57]",
        "svg/use[67]"
      ],
      "role": "node",
      "status": "confirmed"
    },
    {
      "id": "context",
      "name": "Unresolved read/write paths and surrounding recurrent structure",
      "parts": [
        "svg/g[2]/rect[0]",
        "svg/g[2]/g[1]/rect[0]",
        "svg/use[3]",
        "svg/use[5]",
        "svg/use[6]",
        "svg/g[7]/g[0]/rect[0]",
        "svg/g[7]/g[0]/rect[1]",
        "svg/g[7]/g[0]/path[2]",
        "svg/g[7]/use[1]",
        "svg/g[8]/path[0]",
        "svg/g[8]/path[1]",
        "svg/g[9]/path[0]",
        "svg/g[9]/path[1]",
        "svg/g[10]/g[0]/path[0]",
        "svg/g[10]/g[0]/path[1]",
        "svg/g[10]/g[0]/path[2]",
        "svg/g[10]/g[0]/path[3]",
        "svg/g[10]/g[0]/path[4]",
        "svg/g[10]/g[0]/path[5]",
        "svg/g[10]/use[1]",
        "svg/g[11]/g[0]/path[0]",
        "svg/g[11]/g[0]/path[1]",
        "svg/g[11]/g[0]/path[2]",
        "svg/g[11]/g[0]/path[3]",
        "svg/g[11]/g[0]/path[4]",
        "svg/g[11]/g[0]/path[5]",
        "svg/g[11]/g[0]/path[6]",
        "svg/g[11]/use[1]",
        "svg/g[12]/g[0]/path[0]",
        "svg/g[12]/g[0]/path[1]",
        "svg/g[13]/path[0]",
        "svg/g[13]/path[1]",
        "svg/g[14]/path[0]",
        "svg/g[14]/path[1]",
        "svg/g[15]/g[0]/path[0]",
        "svg/g[15]/g[0]/path[1]",
        "svg/g[15]/g[0]/path[2]",
        "svg/g[15]/g[0]/path[3]",
        "svg/g[15]/g[0]/path[4]",
        "svg/g[15]/g[0]/path[5]",
        "svg/g[15]/use[1]",
        "svg/g[16]/g[0]/path[0]",
        "svg/g[16]/g[0]/path[1]",
        "svg/g[16]/g[0]/path[2]",
        "svg/g[16]/g[0]/path[3]",
        "svg/g[16]/g[0]/path[4]",
        "svg/g[16]/g[0]/path[5]",
        "svg/g[16]/g[0]/path[6]",
        "svg/g[16]/use[1]",
        "svg/g[17]/g[0]/path[0]",
        "svg/g[17]/g[0]/path[1]",
        "svg/g[18]/path[0]",
        "svg/g[18]/path[1]",
        "svg/g[19]/path[0]",
        "svg/g[19]/path[1]",
        "svg/g[20]/g[0]/path[0]",
        "svg/g[20]/g[0]/path[1]",
        "svg/g[20]/g[0]/path[2]",
        "svg/g[20]/g[0]/path[3]",
        "svg/g[20]/g[0]/path[4]",
        "svg/g[20]/g[0]/path[5]",
        "svg/g[20]/use[1]",
        "svg/g[21]/g[0]/path[0]",
        "svg/g[21]/g[0]/path[1]",
        "svg/g[21]/g[0]/path[2]",
        "svg/g[21]/g[0]/path[3]",
        "svg/g[21]/g[0]/path[4]",
        "svg/g[21]/g[0]/path[5]",
        "svg/g[21]/g[0]/path[6]",
        "svg/g[21]/use[1]",
        "svg/g[22]/g[0]/path[0]",
        "svg/g[22]/g[0]/path[1]",
        "svg/g[23]/g[0]/path[0]",
        "svg/g[23]/g[0]/path[1]",
        "svg/g[24]/g[0]/path[0]",
        "svg/g[24]/g[0]/path[1]",
        "svg/g[25]/g[0]/path[0]",
        "svg/g[25]/g[0]/path[1]",
        "svg/g[26]/g[0]/rect[0]",
        "svg/g[26]/g[0]/rect[1]",
        "svg/g[26]/g[0]/path[2]",
        "svg/g[26]/use[1]",
        "svg/g[27]/g[0]/rect[0]",
        "svg/g[27]/g[0]/rect[1]",
        "svg/g[27]/g[0]/path[2]",
        "svg/g[27]/use[1]",
        "svg/g[28]/g[0]/rect[0]",
        "svg/g[28]/g[0]/rect[1]",
        "svg/g[28]/g[0]/path[2]",
        "svg/g[28]/use[1]",
        "svg/g[29]/text[0]",
        "svg/g[30]/text[0]",
        "svg/g[31]/line[0]",
        "svg/g[31]/path[1]",
        "svg/g[32]/line[0]",
        "svg/g[32]/path[1]",
        "svg/g[33]/line[0]",
        "svg/g[33]/path[1]",
        "svg/g[34]/text[0]",
        "svg/g[35]/text[0]",
        "svg/g[36]/line[0]",
        "svg/g[36]/path[1]",
        "svg/g[37]/line[0]",
        "svg/g[37]/path[1]",
        "svg/g[38]/line[0]",
        "svg/g[38]/path[1]",
        "svg/g[39]/line[0]",
        "svg/g[39]/path[1]",
        "svg/g[40]/line[0]",
        "svg/g[40]/path[1]",
        "svg/g[41]/line[0]",
        "svg/g[41]/path[1]",
        "svg/g[42]/text[0]",
        "svg/g[43]/text[0]",
        "svg/g[44]/text[0]",
        "svg/g[45]/text[0]",
        "svg/g[46]/line[0]",
        "svg/g[46]/path[1]",
        "svg/g[47]/line[0]",
        "svg/g[47]/path[1]",
        "svg/g[48]/text[0]",
        "svg/g[49]/text[0]",
        "svg/use[50]",
        "svg/use[51]",
        "svg/use[52]",
        "svg/use[53]",
        "svg/use[58]",
        "svg/use[59]",
        "svg/use[60]",
        "svg/use[61]",
        "svg/use[62]",
        "svg/use[63]",
        "svg/use[64]",
        "svg/use[65]",
        "svg/use[66]",
        "svg/use[68]",
        "svg/use[69]"
      ],
      "role": "unknown",
      "status": "unknown"
    }
  ],
  "relations": [
    {
      "kind": "directed_edge",
      "objects": [
        "context",
        "memory1"
      ],
      "connector": null,
      "status": "unknown",
      "rationale": "The read/write links use separate curved shafts and heads. Their grouping/attachment has not been fully resolved; decline this move rather than omit the uncertainty."
    }
  ],
  "coverage": {
    "total_primitives": 143,
    "assigned_primitives": 143,
    "unassigned_parts": []
  }
}
