{
  "schema_version": 2,
  "kind": "diagram-annotation",
  "diagram_id": "distill-graph-tasks",
  "source_url": "https://raw.githubusercontent.com/distillpub/post--understanding-gnns/917b5ea81966de18a08600a3acdb809b009ef478/public/images/graph-tasks.svg",
  "source_sha256": "c55beae1c402cd430eba7a369d5afaf99395713bf6a3be0696bd4ccf17cfc617",
  "license": "CC-BY-4.0",
  "split": "development",
  "review": {
    "status": "agent-reviewed",
    "annotator_type": "agent",
    "annotator": "Codex native-pilot development review",
    "evidence": "Agent visually inspected the original render and source on 2026-10-30. Scripted selectors transcribe that interpretation; no author approval, independent human labels or automatic recovery claim."
  },
  "objects": [
    {
      "id": "input_graph",
      "name": "Input graph with node values and letter labels",
      "parts": [
        "svg/g[4]/g[0]/path[0]",
        "svg/g[4]/g[0]/path[1]",
        "svg/g[4]/g[0]/path[2]",
        "svg/g[4]/g[0]/ellipse[3]",
        "svg/g[4]/g[0]/ellipse[4]",
        "svg/g[4]/g[0]/ellipse[5]",
        "svg/g[4]/g[0]/ellipse[6]",
        "svg/g[4]/g[0]/ellipse[7]",
        "svg/g[4]/g[0]/ellipse[8]",
        "svg/g[4]/g[0]/ellipse[9]",
        "svg/g[4]/g[0]/text[10]",
        "svg/g[4]/g[0]/text[11]",
        "svg/g[4]/g[0]/text[12]",
        "svg/g[4]/g[0]/text[13]",
        "svg/g[4]/g[0]/text[14]",
        "svg/g[4]/g[0]/text[15]",
        "svg/g[4]/g[0]/text[16]",
        "svg/g[4]/g[0]/text[17]",
        "svg/g[4]/g[0]/text[18]",
        "svg/g[4]/g[0]/text[19]",
        "svg/g[4]/g[0]/text[20]",
        "svg/g[4]/g[0]/text[21]",
        "svg/g[4]/g[0]/text[22]",
        "svg/g[4]/g[0]/text[23]"
      ],
      "role": "node",
      "status": "confirmed"
    },
    {
      "id": "tasks",
      "name": "Complete task-example panel",
      "parts": [
        "svg/g[3]/rect[0]",
        "svg/g[4]/path[2]",
        "svg/g[4]/path[3]",
        "svg/g[4]/path[4]",
        "svg/g[4]/ellipse[5]",
        "svg/g[4]/ellipse[6]",
        "svg/g[4]/ellipse[7]",
        "svg/g[4]/ellipse[8]",
        "svg/g[4]/ellipse[9]",
        "svg/g[4]/ellipse[10]",
        "svg/g[4]/ellipse[11]",
        "svg/g[4]/text[12]",
        "svg/g[4]/text[13]",
        "svg/g[4]/text[14]",
        "svg/g[4]/text[15]",
        "svg/g[4]/text[16]",
        "svg/g[4]/text[17]",
        "svg/g[4]/text[18]",
        "svg/g[4]/text[19]",
        "svg/g[4]/text[20]",
        "svg/g[4]/text[21]",
        "svg/g[4]/text[22]",
        "svg/g[4]/text[23]",
        "svg/g[4]/text[24]",
        "svg/g[4]/text[25]",
        "svg/g[4]/path[26]",
        "svg/g[4]/path[27]",
        "svg/g[4]/path[28]",
        "svg/g[4]/ellipse[29]",
        "svg/g[4]/ellipse[30]",
        "svg/g[4]/ellipse[31]",
        "svg/g[4]/ellipse[32]",
        "svg/g[4]/ellipse[33]",
        "svg/g[4]/ellipse[34]",
        "svg/g[4]/ellipse[35]",
        "svg/g[4]/text[36]",
        "svg/g[4]/text[37]",
        "svg/g[4]/text[38]",
        "svg/g[4]/text[39]",
        "svg/g[4]/text[40]",
        "svg/g[4]/text[41]",
        "svg/g[4]/text[42]",
        "svg/g[4]/text[43]",
        "svg/g[4]/text[44]",
        "svg/g[4]/text[45]",
        "svg/g[4]/text[46]",
        "svg/g[4]/text[47]",
        "svg/g[4]/text[48]",
        "svg/g[4]/text[49]",
        "svg/g[4]/g[50]/path[0]",
        "svg/g[4]/g[50]/path[1]",
        "svg/g[4]/g[50]/path[2]",
        "svg/g[4]/g[50]/path[3]",
        "svg/g[4]/g[50]/path[4]",
        "svg/g[4]/g[50]/ellipse[5]",
        "svg/g[4]/g[50]/ellipse[6]",
        "svg/g[4]/g[50]/ellipse[7]",
        "svg/g[4]/g[50]/ellipse[8]",
        "svg/g[4]/g[50]/ellipse[9]",
        "svg/g[4]/g[50]/ellipse[10]",
        "svg/g[4]/g[50]/ellipse[11]",
        "svg/g[4]/g[50]/text[12]",
        "svg/g[4]/g[50]/text[13]",
        "svg/g[4]/g[50]/text[14]",
        "svg/g[4]/g[50]/text[15]",
        "svg/g[4]/g[50]/text[16]",
        "svg/g[4]/g[50]/text[17]",
        "svg/g[4]/g[50]/text[18]",
        "svg/g[4]/g[50]/text[19]",
        "svg/g[4]/g[50]/text[20]",
        "svg/g[4]/g[50]/text[21]",
        "svg/g[4]/g[50]/text[22]",
        "svg/g[4]/g[50]/text[23]",
        "svg/g[4]/g[50]/text[24]",
        "svg/g[4]/g[50]/text[25]",
        "svg/g[4]/path[51]",
        "svg/g[4]/path[52]",
        "svg/g[4]/path[53]",
        "svg/g[4]/ellipse[54]",
        "svg/g[4]/ellipse[55]",
        "svg/g[4]/ellipse[56]",
        "svg/g[4]/ellipse[57]",
        "svg/g[4]/ellipse[58]",
        "svg/g[4]/ellipse[59]",
        "svg/g[4]/ellipse[60]",
        "svg/g[4]/text[61]",
        "svg/g[4]/text[62]",
        "svg/g[4]/text[63]",
        "svg/g[4]/text[64]",
        "svg/g[4]/text[65]",
        "svg/g[4]/text[66]",
        "svg/g[4]/text[67]",
        "svg/g[4]/text[68]",
        "svg/g[4]/text[69]",
        "svg/g[4]/text[70]",
        "svg/g[4]/text[71]",
        "svg/g[4]/text[72]",
        "svg/g[4]/text[73]",
        "svg/g[4]/text[74]",
        "svg/g[4]/text[75]",
        "svg/g[4]/text[76]",
        "svg/g[4]/text[77]",
        "svg/g[4]/text[78]",
        "svg/g[4]/text[79]",
        "svg/g[4]/text[80]"
      ],
      "role": "node",
      "status": "confirmed"
    },
    {
      "id": "task_mapping",
      "name": "task_mapping",
      "parts": [
        "svg/g[4]/path[1]"
      ],
      "role": "connector",
      "status": "confirmed"
    }
  ],
  "relations": [
    {
      "kind": "directed_edge",
      "objects": [
        "input_graph",
        "tasks"
      ],
      "connector": "task_mapping",
      "status": "confirmed",
      "rationale": "Agent interpretation of the original rendered connection and source geometry; not independently verified author intent."
    }
  ],
  "coverage": {
    "total_primitives": 130,
    "assigned_primitives": 130,
    "unassigned_parts": []
  }
}
